code,current_title,current_price,recommended_title,recommended_price,hero_potential,verify_approved,search_keywords,why_pay_wedge
P01,The Sensory Play Activity Card Deck,24,"Baby Sensory Play Cards: 80 Newborn and Toddler Activities for 0-3, Most Using What's in Your Kitchen. Printable PDF",24,high,False,baby sensory play | sensory activities for babies | newborn sensory play | sensory play cards 0-3 | toddler sensory activities | sensory play ideas for infants | baby development activities printable,"A free Pinterest search hands you an infinite, unsorted list that assumes a craft cabinet; this is finite, sorted by your kid's exact age, and choke-safety-flagged for the months it matters most."
P02,"The ""Saying No"" Script Pack",7,"Postpartum Visitor Boundary Scripts. What to Say to Family, In-Laws, and Advice-Givers. 30 Scripts + 5 Templates PDF",9,high,False,postpartum visitor boundaries | no visitors newborn sign | setting boundaries with in-laws after baby | new baby boundary scripts | how to tell family no visitors | fourth trimester visitor rules | unsolicited baby advice comebacks,"A free Pinterest door sign covers one knock. This gives you the exact words for the in-law at the door, the four-hour stayer, the feeding opinions, and the whole-family group text, ready before your sleep-starved brain has to find them."
P03,The Slow Motherhood Weekly Planner,12,"Undated Self Care Planner for Mom: Slow Motherhood Journal. Weekly Reflection, No Dates, Anti Productivity. Postpartum Journal, Used Badly",13,high,False,undated planner for moms | self care planner for mom | motherhood journal | mom planner no dates | weekly reflection planner | anti productivity planner | postpartum self care journal,"Free printables are all the productivity systems she already abandoned. This is the one planner that is undated, asks two honest questions instead of demanding ten tasks, and is designed to be used badly without shame, so she actually opens it again next week."
P04,The Partner's Postpartum Playbook,9,The Partner's Postpartum Playbook: A New Dad Survival Guide and Baby Shower Gift,14,high,False,how to help your wife after birth | postpartum gift for new dad | new dad survival guide | partner postpartum support guide | what to do after baby is born for dads | baby shower gift for the partner | postpartum guide for husbands,"Free Pinterest lists are written to her about how to ask for help. This is the only one written to the partner, telling you what to do and in what order so she never has to."
P05,The 30-Day Screen-Free Family Challenge,9,Screen-Free Activities for Kids 3-10. 30-Day Family Challenge: Printable Activity Cards and Tracker. No Phone Summer,11,high,False,screen free activities for kids | screen free activity cards | 30 day screen free challenge | screen free printable kids | screen time alternatives for kids | indoor activities for kids printable | family screen free challenge,"The free Pinterest list is one graphic you scroll past. This is thirty cards you can actually pull from a basket, each with the materials and time and age already sorted, plus the part no list tells you: day nine will fall apart, here is what to do, and skipping days still counts."
P06,The C-Section Recovery Planner,14,C-Section Recovery Planner: Week by Week Printable Postpartum Healing Tracker for Weeks 1 to 6,15,high,False,c section recovery planner | c section recovery checklist printable | postpartum recovery planner week by week | cesarean recovery tracker | c section postpartum care log | incision care tracker printable | scheduled c section prep,"The free Pinterest version is a generic postpartum checklist that assumes you can stand, lift, and drive. This one is written by someone who had the surgery, tracks the incision and the week-2-and-3 setback traps day by day, and hands your partner a page that says exactly what not to ask you to do."
P07,The Newborn Survival Planner,14,Newborn Feeding and Diaper Log: A First Six Weeks Planner. Daily Tracker and What's Normal Reference for New Parents,15,high,False,newborn feeding and diaper log | first 6 weeks postpartum planner | newborn daily log printable | newborn schedule tracker | new parent survival kit printable | postpartum recovery planner | baby feeding tracker pdf,"The free Pinterest log tracks only the baby and assumes a rested two-handed parent. This one is built to be filled one-handed in the dark, pairs the log with a curated what's-normal reference so you stop googling at 3am, and adds a recovery check-in for the parent that the free versions leave out."
P08,A Pregnancy Week-by-Week Journal,16,"Pregnancy Journal Week by Week: First-Time Mom Keepsake Memory Book, Weeks 6 to 40",16,high,False,pregnancy journal | pregnancy week by week | pregnancy journal week by week | first time mom pregnancy journal | pregnancy memory book | weekly pregnancy planner | pregnancy keepsake journal,"The free Pinterest version rates your 'glow' and assumes one planned baby and forty smooth weeks; this one holds the worry you have not said out loud, gives loss, IVF, high-risk, donor, and surprise pregnancies a page, and puts a plain-language symptom reference and your emergency numbers at the back."
P09,A Postpartum Mind Journal,14,Postpartum Depression and Anxiety Journal: Mood Tracker for the First Year. A Postpartum Mind Journal,16,high,False,postpartum depression journal | PPD journal printable | postpartum mood tracker | postpartum mental health journal | postpartum depression and anxiety tracker | new mom mental health journal | PPD symptom log to bring to doctor,"The free Pinterest 'self-care' printables are mood-rating circles with no clinical scaffolding. This is a careful, plain-language instrument built to produce a record a real provider can read, with a vetted when-to-call list and crisis lines, so it does the one thing a free worksheet can't: get you to actual help with notes in hand."
P11,A Newborn Sleep Log,12,Printable Baby Sleep and Feeding Tracker: A Newborn Log for the Foggy Weeks,14,medium,False,baby sleep and feeding tracker printable | newborn sleep log | baby feeding and diaper log printable | newborn sleep tracker pdf | baby sleep log book first year | infant feeding tracker for pediatrician | sleep regression tracker baby,"A free printout tracks one night. This is the only log that remembers what you already tried, names the regression you are in, and hands a clean summary to your partner and your pediatrician, so you stop guessing in circles."
P12,A Breastfeeding Troubleshooting Guide,9,"Breastfeeding Troubleshooting Guide: Newborn Latch Checklist, Positions, and Combo Feeding: Printable Lactation PDF",12,high,False,breastfeeding latch help | breastfeeding troubleshooting guide | painful latch newborn | newborn latch checklist printable | combo feeding guide | breastfeeding positions printable | lactation consultant prep sheet,"Free Pinterest gives you scattered latch tips. This gives you a single decision tree that names the one adjustment to try and the exact line where you stop trying and call, plus a fill-in page you hand straight to the lactation consultant."
P13,The Toddler Big Feelings Cards,12,"Toddler Emotions Flash Cards: Big Feelings, Calm-Down and Repair Cards for Ages 2 to 5",14,high,False,toddler emotions flash cards | feelings cards for kids | calm down corner printable | emotional regulation cards toddler | big feelings cards | feelings flashcards preschool | calm down kit printable,"Free Pinterest printables stop at happy-face / sad-face and a single sheet. This is a sorted four-deck system that names the feeling, locates it in the body, gives one doable action, and handles the repair after, written by a parent who timed a forty-seven-minute parking-lot meltdown, finite and ready to print tonight instead of an infinite scroll you never actually use."
P14,A Birth Plan Worksheet Pack,9,"Birth Plan Template, Printable and Fillable PDF. Editable Worksheet Pack, C-Section Included, One Page Nurse Summary",12,high,False,birth plan template | printable birth plan | fillable birth plan pdf | editable birth plan | birth plan worksheet | c-section birth plan | one page birth plan,"The free Pinterest birth plan is the four-page checkbox document the nurse skims and sets down. This is the one-page version she can read in the first minute, with the C-section, NICU, and 'if I cannot speak' pages free templates never include."
P15,The Visitor Welcome Packet,9,New Baby Door Sign and How to Help List with Meal Train Page. The Visitor Welcome Packet,12,high,False,newborn visitor rules sign printable | no visitors new baby sign | how to help new mom checklist | postpartum door sign | meal train sign up printable | new baby boundaries grandparents | what can I bring new mom list,"The free Pinterest version is one static door sign. This is the whole front-of-house you fill in once in the third trimester, so visitors help themselves to the dishwasher, the meal train, and the dog walk without asking the depleted person a single question."
P16,The Tantrum-in-the-Moment Scripts,9,What to Say During a Toddler Tantrum: 30 In-the-Moment Scripts for the Kitchen Floor,12,high,True,what to say during a toddler tantrum | toddler tantrum scripts | gentle parenting tantrum cards | calm down phrases for kids | what to say when toddler hits | tantrum survival cards for parents | toddler meltdown printable,"The free Pinterest version is written for the calm parent in the parenting book. This is written for the actual you, mid-meltdown, brain half-offline, and gives you six-second lines plus the three things you should not say, so you stop improvising the sentence you will regret."
P17,A Back-to-Work Pumping Planner,14,"Return to Work Pumping Schedule and Breast Pumping Planner: For the Day Before, and Every Day After",16,high,False,pumping at work schedule | return to work pumping plan | pumping schedule printable | breast pumping planner | back to work breastfeeding | pumping at work supervisor script,"The free Pinterest version gives you a blank schedule grid. This gives you the six supervisor scripts, the PUMP Act escalation steps, and the travel-day plan, the parts nobody hands you for free."
P18,A Toilet Learning Planner,12,Potty Training Planner and Printable Chart: A Gentle Four Week Pace,14,high,False,potty training planner | potty training chart printable | potty training tracker | toddler potty training schedule | gentle potty training | potty training daycare sheet,"The free Pinterest version is a reward sticker chart that assumes it works in three days. This is the honest plan for the messy two-to-twelve weeks it actually takes, including the daycare and grandparent handoff pages and a page for the parent who is more stressed than the kid."
P19,A Sibling Adjustment Pack,12,"Preparing Older Sibling for New Baby: Scripts, Hospital Day Plan and Regression Help. For the Bigger One",14,high,False,preparing older sibling for new baby | new baby toddler adjustment | second baby preparation printable | big brother big sister new baby | what to say to toddler about new baby | sibling jealousy newborn | becoming a big sibling pack,"The free Pinterest version tells you 'they might regress, give them special attention.' This gives you the fill-in hospital-day plan, the arms-free first-meeting choreography, the word-for-word grandparent door scripts, the during-feeds basket of twenty activities, and a keepsake letter for the older one, the specific things you cannot assemble from a pin at 4am."
P20,A Gentle Companion for Pregnancy Loss,12,"Pregnancy Loss Journal and Keepsake: A Gentle Gift After Miscarriage or Stillbirth, Any Week",14,high,False,miscarriage journal | pregnancy loss gift | miscarriage memory book | pregnancy loss keepsake | miscarriage gift for friend | stillbirth memory book | grief journal pregnancy loss,"Free Pinterest grief lists never touch the hard-to-say parts. This hands you the exact words for 'is this your first,' the 'at least it was early' reply, and the boss conversation, plus keepsake pages to hold a name and a date."
P21,A Postpartum Anxiety Companion,14,"Postpartum Anxiety Journal: a noticing log, grounding cards, a partner page, and the signs that mean call today. For the racing nights",14,high,False,postpartum anxiety workbook | postpartum anxiety journal | is this normal postpartum anxiety | postpartum mental health tracker | new mom anxiety printable | postpartum anxiety help for partner | when to call doctor postpartum,"The free Pinterest version gives you breathing tips. This gives you the named pattern and the exact 'call your provider today' signs, so you walk into the appointment with two weeks of evidence instead of the word 'fine.'"
P22,An Introducing Solids Planner,12,"Starting Solids Planner: baby first foods, allergen log, readiness signs. For the first spoon.",12,medium,False,starting solids planner | baby first foods chart | allergen introduction schedule for babies | baby led weaning printable | when is baby ready for solids | baby food log printable | introducing solids guide,"Pinterest gives you the readiness signs for free, but not the writable big-9 allergen log, the daily eating record, the safe-size cut rules, and the relative scripts all in one undated place you actually fill in."
P23,The Mom Rage Workbook,14,"Postpartum Mom Rage Workbook: anger, irritability, and the repair after the yelling",14,high,False,postpartum mom rage workbook | mom anger workbook | postpartum rage | why am i so angry after having a baby | stop yelling at my kids printable | postpartum irritability | parenting anger journal,"The free version is a generic count-to-ten graphic. This gives you a trigger map that reveals your own pattern over a month and a library of exact repair words to say to a toddler, an older kid, your partner, and yourself, plus the honest signs that say call someone now."
P24,The Bedtime Routine Cards,9,"Toddler Bedtime Routine Cards, Printable Visual Schedule for Kids Ages 1-6: The Child Builds the Order",12,high,False,toddler bedtime routine cards printable | visual bedtime schedule for kids | bedtime routine chart toddler | printable bedtime cards ages 1-6 | kids bedtime routine cards | bedtime visual schedule cards | toddler bedtime routine printable,"Free Pinterest charts are a fixed list the parent enforces, so the kid still fights it. This is a deck the child reorders every night, plus emotion-check cards and a hard-night protocol, so the structure ends the negotiation instead of being one more thing to argue about."
P25,A Holiday Boundary Pack,9,What to Say to Family at the Holidays: Boundary Scripts for the Table You Have to Sit At,14,high,True,what to say to family at the holidays | setting boundaries with in-laws | holiday boundary scripts | comebacks for rude comments about my baby | how to handle nosy relatives at thanksgiving | scripts for unsolicited parenting advice | new mom holiday survival kit,"The free Pinterest version gives you ten clever comebacks you forget by the time the comment lands. This gives you the pre-gathering worksheet, the grounding cards for the bathroom break, the kid-handoff plan, and the drive-home debrief, so you walk in prepared and walk out without the loop."
P26,A Single-Parent Postpartum Planner,14,Single Mom Postpartum Planner: For the Version of You Doing It Alone. Single Parent Newborn Survival Plan Printable PDF,14,high,False,single mom postpartum planner | single parent newborn planner | solo mom postpartum | postpartum planner no partner | single mom by choice baby plan | newborn survival plan single parent | postpartum support plan printable,"The free Pinterest checklist says 'ask your partner to take the night feed.' You don't have one. This is the only planner built for the half of the work that has no second adult, with the village page, the aid index, and the 3am numbers already filled in."
P27,The Hospital Bag Checklist,7,"Hospital Bag Checklist Printable: What to Pack for Mom, Partner, and Baby. Labor and Delivery List",9,medium,False,hospital bag checklist printable | what to pack in hospital bag | hospital bag list for mom and partner | third trimester hospital bag | hospital bag checklist pdf | newborn hospital bag list | labor and delivery packing list,"The free Pinterest lists are written to sell you forty-three things. This one is the shorter list someone wrote after packing the bag twice, including what to skip and what the hospital already provides, plus a fill-in card a friend can follow if they have to grab it for you."
P28,A NICU Parent Planner,16,"NICU Parent Planner and Journal: daily log for rounds, plain-language glossary, preemie and premature baby notebook",16,high,False,NICU planner | NICU journal | NICU mom notebook | preemie planner | premature baby journal | NICU parent gift | NICU daily log,"The free Pinterest version is a blank tracker. This one hands you the plain-language glossary so you can follow rounds, and it holds both endings with the same care instead of pretending every NICU story goes home."
P29,A 'Who Am I Now' Journal,14,Who Am I Now. Postpartum Identity Journal: Matrescence Reflection Prompts for the New Mom Self,15,high,False,postpartum identity journal | matrescence journal | new mom journal prompts | motherhood reflection journal | who am i now postpartum | self-discovery journal for moms | postpartum mental health printable,"Free Pinterest prompt lists give you ten generic questions you answer once and forget. This gives you twelve prompts written to refuse easy answers, paired pages for grief and claiming, and a dated yearly ritual you reuse for a decade, so it becomes a record of who you were becoming rather than a worksheet you fill in and lose."
P30,The Sibling Conflict Scripts,9,Sibling Fighting Scripts for Parents: 40 Calm Things to Say When Your Kids Won't Stop,12,high,True,sibling fighting | how to stop kids fighting | sibling rivalry printable | what to say when siblings fight | sibling fighting scripts | gentle parenting sibling conflict | stop kids arguing,"Free Pinterest graphics give you one nice phrase. This gives you forty, sorted by the exact fight, plus the list of what not to say, so your brain can be offline and you still have the right words."
P31,A Returning-to-Work Plan,14,Back to Work After Baby: Return to Work Planner for New Moms | Maternity Leave Return Plan | First 90 Days Checklist | Printable PDF,14,high,False,back to work after baby | return to work after maternity leave | working mom planner | maternity leave return plan | return to work checklist new mom | postpartum back to work | working parent planner printable,"The free Pinterest version is a generic 'back to work checklist,' but this hands you three ready-to-read manager scripts graded by how supportive your boss is, plus a 90-day decision page that the free stuff never gives you."
P32,The Babysitter & Daycare Handoff Pack,9,Babysitter Information Sheet and Emergency Contact Form: Daycare Consent Forms and Caregiver Instructions Printable.,14,high,False,babysitter information sheet | nanny binder printable | emergency contact form for babysitter | daycare consent form printable | babysitter notes template | child medical consent form | caregiver instructions printable,"The free Pinterest sheet is one page of phone numbers. This is the editable medical-emergency consent, the daycare pickup-authorization, and the 'what we don't do' page that the free version never gives you."
P33,A Twin Pregnancy Week-by-Week Planner,16,"Twin Pregnancy Planner and Journal: Week by Week, for the pregnancy the other planners don't cover",16,high,False,twin pregnancy planner | twin pregnancy journal | pregnant with twins gift | expecting twins planner | twin pregnancy week by week | twin pregnancy gift for mom,"Free Pinterest pregnancy printables assume one baby, so they silently lie about your weight curve, your appointment cadence, your delivery week, and your NICU odds. This is the one planner written from the math that there are two."
P34,Newborn Cue Decoder Cards,9,What Does My Baby's Cry Mean: Printable Newborn Cue Cards for the First Six Weeks,12,medium,False,what does my baby's cry mean | newborn cues chart | baby cry meaning guide | newborn cry decoder | baby hunger and tired cues | newborn sleep cues printable | decode baby cries,"The free Pinterest chart is one image that names a cry. This is thirty cards that also tell you what to actually try, when a cue is NOT what it looks like, and the exact signs that mean stop reading cards and call the pediatrician."
P35,An IVF Cycle Planner and Journal,16,"IVF Planner and Journal: stim tracker, two week wait, beta day. Printable IVF cycle tracker for one full cycle.",16,high,False,ivf planner | ivf journal | ivf binder printable | ivf cycle tracker | stim phase tracker | two week wait journal | ivf medication tracker printable,"The free Pinterest printout is a blank med chart. This one tracks the cost the clinic portal hides, the embryo report morning by morning, and the two outcomes the free versions never make room for, all without naming a single medication."
P36,A Sleep-Disruption Pattern Journal,9,"Baby Sleep Regression Journal: a two-week tracker to see the night-waking pattern, not a method.",12,medium,False,baby sleep regression journal | toddler sleep regression tracker | baby sleep tracker printable | 4 month sleep regression help | sleep log before sleep training | baby night waking log,"The free Pinterest sleep tracker is a blank grid that nudges you toward a method. This one refuses that: day and night side by side, a what-we-already-tried record so you stop repeating yourself, and a page that tells you when the right next step is the pediatrician, not the next program."
P37,Pediatrician Visit Prep Cards,9,"Well Baby Visit Cards: Questions to Ask + Checkup Record, Newborn to 2 Years",11,medium,False,well baby visit tracker | pediatrician questions to ask printable | well child visit schedule | baby checkup record | newborn doctor appointment checklist | baby milestone and growth tracker printable,"The free Pinterest list gives you questions to ask once. This gives you a card per visit to fill in and keep, so after two years you own the whole growth-and-recommendations record in one folder, even if you switch doctors or move."
P38,Postpartum Freezer Meal Cookbook,11,Postpartum Freezer Meals for New Moms: 30 Make-Ahead Recipes You Can Eat With One Hand. Printable Cookbook PDF,12,high,False,postpartum freezer meals | freezer meals for new moms | make ahead meals for new parents | new baby meal train gift | freezer meal cookbook printable | one handed meals for nursing mom | postpartum meal prep,"Free freezer-meal lists are generic and assume two working hands and a clear afternoon. This is curated for the recovering body: one hand, a tender system, the 11pm partner reheat, food still good lukewarm, plus a grocery list, freezer map, and reheat table so the whole plan runs itself."
P39,A VBAC Prep Planner,12,VBAC Birth Plan and Prep Planner: a printable TOLAC and repeat cesarean planner with questions for your doctor,14,high,False,vbac birth plan | vbac planner printable | tolac birth plan | vaginal birth after cesarean | vbac prep | repeat cesarean birth plan | vbac questions for doctor,"A free Pinterest VBAC checklist tells you what to want, this one stays neutral and hands you the exact provider and hospital scripts, the operative-report chase, and a real plan for both outcomes so you walk in with the work already done."
P40,A Rainbow Baby Planner,14,"Pregnancy After Loss Planner. Rainbow Baby Planner for Pregnant After Miscarriage, a calm place for the second story",16,high,False,pregnancy after loss planner | rainbow baby planner | pregnant after miscarriage | pregnancy after loss journal | rainbow baby pregnancy gift | pregnant again after loss | pregnancy after loss anxiety,"The free Pinterest version is a pretty checklist that assumes a happy pregnancy. This one was written for the body that remembers, names the anniversary spikes and the \""what if it happens again\"" question other planners pretend away, and puts crisis lines and real routing to perinatal care where you can find them at 3 a.m."
P41,A Daily Notes Journal,11,A Discreet Fertility Tracker Journal: TTC and Cycle Notes in a Plain Daily Notebook,14,high,False,fertility tracker journal | TTC journal | discreet fertility journal | BBT tracking journal | ovulation and cycle tracking printable | trying to conceive notebook | basal body temperature log,"A free Pinterest tracker says \""ovulation\"" and \""cycle day\"" right on the page, so anyone who picks it up knows. This one does the same full tracking in plain words with a decode you can tear out, so you can keep it on the counter and no one knows but you."
P42,Babyproofing Room-by-Room Checklist,7,Babyproofing Checklist Printable PDF: Baby Safety Room by Room for the Crawling Stage,9,medium,False,baby proofing checklist printable | babyproofing checklist pdf | room by room baby proofing list | home safety checklist for baby crawling | new baby safety checklist | childproofing checklist printable,"The free Pinterest version gives you a generic list and an affiliate link to the brand someone got paid to recommend. This one names the hazard, leaves the solution to your house and budget, and tells you which ten fixes to do first when you only have one weekend."
