code,current_title,current_price,recommended_title,recommended_price,hero_potential,verify_approved,search_keywords,why_pay_wedge
P43,A First Birthday Planning Kit,9,"First Birthday Party Planner Printable: 1st Birthday Checklist, Planning Kit, 6-Week Countdown, Smash Cake. A day, not a wedding.",11,medium,False,first birthday party planner | 1st birthday checklist printable | first birthday planning kit | baby first birthday party checklist | 1st birthday party planner printable | first birthday countdown | smash cake decision printable,"The free Pinterest checklist gives you 30 things to buy. This gives you permission to do less, plus a letter-to-baby and guest quote-book that turn the day into something you reread at eighteen."
P44,A Toddler Travel Activity Pack,9,"Toddler Travel Activity Pack: Airplane and Road Trip Printables, Scavenger Hunts and Quiet-Time Activities Ages 2 to 5",12,medium,True,toddler airplane activities printable | toddler road trip activities | travel activities for toddlers | kids car scavenger hunt printable | toddler travel busy book | flight activities for toddlers,"The free Pinterest scavenger hunt does not pack your bag, plan the flight-versus-road-trip logistics, or hand you a script for the moment your kid is screaming at hour three and you have run out of ideas."
P45,"Twin Postpartum, the First Six Weeks",14,"Twin Postpartum Planner: First Six Weeks Home With Two. Printable Newborn Feed and Diaper Log, Recovery, Night Schedule",16,high,False,twin newborn schedule | twins feeding tracker printable | twin postpartum planner | newborn twins planner | twin feed and diaper log | twin parents night schedule | twin mom postpartum planner,"The free Pinterest version is a singleton checklist you would have to mentally double all day on no sleep. This is built for two from the first line: one side-by-side log, one rotation page, one set of scripts for the people who come to gawk at the twins instead of help."
P46,"Eldercare, the First 90 Days",14,"Caregiver Planner for Aging Parents: Eldercare, the First 90 Days. Hospital Discharge, Medical Team, Legal Paperwork, Burnout",14,high,False,caregiver planner for aging parents | elderly parent care organizer | aging parent binder printable | dementia caregiver planner | hospital discharge planner family | caregiver burnout journal | elder care planner for adult children,"The free Pinterest 'aging parent checklist' gives you contact fields, this gives you the burnout self-check, the sibling-conflict pages, and a weighted where-they-will-live decision matrix, the parts of caregiving nobody else writes down."
P47,Stay-at-Home Parent Transition Planner,11,"Stay-at-Home Parent Planner: Money, Retirement, and Identity for a One-Income Family",14,high,False,stay at home mom planner | becoming a stay at home mom | quitting job to be a stay at home mom | stay at home mom budget | one income family budget planner | stay at home parent finances | sahm planner printable,"The free Pinterest version is a cute daily-routine printable, this is the only one that makes you fund the spousal IRA, balance the 'what if we split' protections, and plan the resume gap before they quietly cost you years."
P48,Adoption Wait + Welcome Pack,12,Adoption Planner and Home Study Checklist. Foster to Adopt Journal for the Pregnancy That Does Not Show,16,high,False,adoption planner | home study checklist | adoption paperwork organizer | waiting to adopt journal | foster to adopt planner | adoption binder printable | adoption journal,"Free checklists tell you what to file. This one also holds the wait, the failed-match grief, the match call, and the words your child will hear about how your family came together."
P49,The Asking for Help Script Pack,7,"How to Ask for Help: 30 Postpartum and Caregiver Scripts for Meals, Childcare, and Money. With an Easy Way to Say No",12,high,False,how to ask for help | asking for help scripts | postpartum support for new moms | meal train sign up wording | new mom help text templates | what to say to ask for help | caregiver help scripts,"The free Pinterest version is a list of ways friends can help a new mom, written for the helper. This is the opposite and harder thing: the exact words the person who needs help sends, copy-paste ready, including the money and emotional asks no free list will touch, and the when-they-say-no and thank-you scripts that keep the relationship intact afterward."
P50,The Family Caregiver Workbook,14,Caregiver Planner for Aging Parents: The Long Stretch. A Printable Family Caregiver Workbook for the Long Haul,14,high,False,caregiver planner for aging parents | caring for elderly parent organizer | family caregiver workbook printable | long term caregiver planner | caregiver burnout journal | elderly parent care binder | caregiving for a sick spouse planner,"The free Pinterest version is a medication chart and an appointment tracker. This one has the respite plan, the sibling-conflict mediation pages, and the 'I am angry / I am exhausted / I cannot do this forever' pages that no free printable will write for you."
P51,The Pregnancy Safety Reference,11,"Is It Safe During Pregnancy: Questions for Your OB or Midwife, Organized by Category. A 30-Page Reference",12,high,False,is it safe during pregnancy | pregnancy safe food list | questions to ask your OB | what can I eat while pregnant | pregnancy questions for doctor appointment | pregnancy do's and don'ts printable | first trimester safety guide,"The free Pinterest list hands you a stranger's yes-or-no verdict; this hands you an organized question list for the one person who can actually see your pregnancy, your history, and your risk factors, so you stop letting the internet be the tiebreaker."
P52,The Birth Anxiety Workbook,12,Fear of Childbirth Workbook: a printable for birth anxiety and the fear of labor and delivery. Being scared to give birth is okay.,16,high,False,fear of childbirth workbook | birth anxiety workbook | tokophobia help | scared to give birth | afraid of giving birth | fear of labor and delivery | birth fear journal printable,"The free Pinterest version gives you \""trust your body\"" affirmations. This names your specific fear, hands you the exact words to tell the team, and tells you when the fear is bigger than a worksheet and who to call."
P53,A Trimester-by-Trimester Emotional Companion,11,"A Pregnancy Emotions Journal: Prenatal Prompts, Trimester by Trimester",14,high,False,pregnancy journal | pregnancy emotions journal | pregnancy mental health journal | prenatal journal prompts | pregnancy feelings journal | trimester by trimester journal | fillable pregnancy journal,"Free Pinterest 'pregnancy journal prompts' celebrate the bump. This is the only one that gives you room to grieve your old life while still wanting the baby, plus a real perinatal crisis-resource page and a named voice that tells the truth instead of a checklist of cute milestones."
P54,The Pregnancy + Work Planner,12,"Maternity Leave Planner: Telling Your Boss, HR Scripts, Handoff Template. Pregnant at Work, Sorted.",15,high,True,maternity leave planner | telling your boss you're pregnant | pregnancy at work planner | maternity leave handoff document template | pregnancy work accommodations checklist | return to work after maternity leave plan | how to tell HR you're pregnant,"Pinterest gives you a 'when to announce' infographic. This gives you the exact words for the boss and HR meetings and a fillable handoff document, so the leave is something you planned instead of something that happened to you."
P55,The Partner-During-Pregnancy Companion,11,Pregnancy Guide for Partners and Dads-to-Be. The Nine Months You Are Also Living. Gift for Expecting Dad. Printable PDF,13,high,False,pregnancy book for dad | gift for expecting dad | partner pregnancy guide | dad to be gift pregnancy | pregnancy guide for partners | first time dad pregnancy book | expecting partner gift printable,"The free Pinterest version for dads stops at \""rub her feet and stay calm.\"" This one hands you the actual appointment role, the things to never say, a private grief-and-fear page, and partner-specific crisis lines, the parts no one writes down."
P56,"Letters to Baby, a Pregnancy Keepsake Journal",14,Letters to My Unborn Baby: A Pregnancy Keepsake Journal and Expecting Mom Gift,14,high,True,letters to my unborn baby | pregnancy journal for the baby | letter to baby keepsake | expecting mom gift journal | pregnancy keepsake journal | baby shower keepsake gift | write to baby before birth,"Free printables give you one blank page that says 'Dear Baby'. This gives you a structured arc of thirteen dated letters across the whole pregnancy, plus real pockets for the ultrasound print and the hospital band, so it becomes one object the kid can hold at eighteen instead of a folder of loose sheets."
